{
  "$defs": {
    "ImageRef": {
      "additionalProperties": false,
      "description": "Opaque asset reference; SHA-256 covers encoded file bytes, not pixels.",
      "properties": {
        "asset_id": {
          "minLength": 1,
          "pattern": "\\S",
          "title": "Asset Id",
          "type": "string"
        },
        "sha256": {
          "pattern": "^[0-9a-f]{64}$",
          "title": "Sha256",
          "type": "string"
        },
        "width": {
          "exclusiveMinimum": 0,
          "title": "Width",
          "type": "integer"
        },
        "height": {
          "exclusiveMinimum": 0,
          "title": "Height",
          "type": "integer"
        }
      },
      "required": [
        "asset_id",
        "sha256",
        "width",
        "height"
      ],
      "title": "ImageRef",
      "type": "object"
    }
  },
  "additionalProperties": false,
  "properties": {
    "schema_version": {
      "const": "1.0",
      "default": "1.0",
      "title": "Schema Version",
      "type": "string"
    },
    "request_id": {
      "minLength": 1,
      "pattern": "\\S",
      "title": "Request Id",
      "type": "string"
    },
    "command": {
      "minLength": 1,
      "pattern": "\\S",
      "title": "Command",
      "type": "string"
    },
    "image": {
      "$ref": "#/$defs/ImageRef"
    },
    "environment_version": {
      "minLength": 1,
      "pattern": "\\S",
      "title": "Environment Version",
      "type": "string"
    },
    "mode": {
      "const": "C",
      "default": "C",
      "title": "Mode",
      "type": "string"
    }
  },
  "required": [
    "request_id",
    "command",
    "image",
    "environment_version"
  ],
  "title": "Request",
  "type": "object",
  "$schema": "https://json-schema.org/draft/2020-12/schema"
}
