{
  "schema_version": "1.0",
  "request_id": "req-001",
  "command": "빨간 큐브를 A 구역으로 옮겨 줘.",
  "image": {
    "asset_id": "io-only-frame",
    "sha256": "7c73b2783492642c80125969f2c038e32d9349cc7c61c125818589d59df4f7ea",
    "width": 32,
    "height": 24
  },
  "environment_version": "lab-v1",
  "mode": "C"
}
